{
  "$schema": "https://json-schema.org/draft/2020-12/schema",
  "$id": "https://project-status.invalid/schema/manifest-v1.json",
  "title": "Project Status Initiative Manifest",
  "type": "object",
  "additionalProperties": false,
  "required": [
    "schemaVersion",
    "route",
    "initiative",
    "source",
    "audit",
    "totalWeight",
    "phases",
    "evidence",
    "gates",
    "dependencies"
  ],
  "properties": {
    "schemaVersion": {
      "const": 1
    },
    "route": {
      "type": "string",
      "pattern": "^/(?!/)(?!.*(?:^|/)\\.\\.(?:/|$))(?!.*[?#\\\\])[A-Za-z0-9._~!$&'()*+,;=:@%/-]*$"
    },
    "initiative": {
      "$ref": "#/$defs/initiative"
    },
    "source": {
      "$ref": "#/$defs/source"
    },
    "audit": {
      "$ref": "#/$defs/audit"
    },
    "totalWeight": {
      "const": 100
    },
    "phases": {
      "type": "array",
      "minItems": 1,
      "items": {
        "$ref": "#/$defs/phase"
      }
    },
    "evidence": {
      "type": "array",
      "items": {
        "$ref": "#/$defs/evidence"
      }
    },
    "gates": {
      "type": "array",
      "items": {
        "$ref": "#/$defs/gate"
      }
    },
    "dependencies": {
      "type": "array",
      "items": {
        "$ref": "#/$defs/dependency"
      }
    }
  },
  "$defs": {
    "initiative": {
      "type": "object",
      "additionalProperties": false,
      "required": [
        "id",
        "name",
        "release",
        "state"
      ],
      "properties": {
        "id": {
          "type": "string",
          "pattern": "^[a-z0-9]+(?:-[a-z0-9]+)*$"
        },
        "name": {
          "type": "string",
          "minLength": 1
        },
        "release": {
          "type": "string",
          "minLength": 1
        },
        "state": {
          "enum": [
            "proposal",
            "active",
            "complete",
            "superseded"
          ]
        }
      }
    },
    "source": {
      "type": "object",
      "additionalProperties": false,
      "required": [
        "repository",
        "commit",
        "deploymentId",
        "buildId",
        "manifestSha256"
      ],
      "properties": {
        "repository": {
          "anyOf": [
            {
              "type": "string",
              "pattern": "^https://"
            },
            {
              "type": "null"
            }
          ]
        },
        "commit": {
          "anyOf": [
            {
              "type": "string",
              "pattern": "^[a-f0-9]{40}$"
            },
            {
              "type": "null"
            }
          ]
        },
        "deploymentId": {
          "anyOf": [
            {
              "type": "string",
              "minLength": 1
            },
            {
              "type": "null"
            }
          ]
        },
        "buildId": {
          "anyOf": [
            {
              "type": "string",
              "minLength": 1
            },
            {
              "type": "null"
            }
          ]
        },
        "manifestSha256": {
          "anyOf": [
            {
              "type": "string",
              "pattern": "^[a-f0-9]{64}$"
            },
            {
              "type": "null"
            }
          ]
        }
      }
    },
    "audit": {
      "type": "object",
      "additionalProperties": false,
      "required": [
        "auditId",
        "state",
        "evidenceAsOf",
        "verifiedAt",
        "nextDueAt",
        "staleAfterSeconds"
      ],
      "properties": {
        "auditId": {
          "type": "string",
          "pattern": "^[a-z0-9]+(?:-[a-z0-9]+)*$"
        },
        "state": {
          "enum": [
            "proposal",
            "current",
            "stale",
            "superseded"
          ]
        },
        "evidenceAsOf": {
          "type": "string",
          "pattern": "^\\d{4}-\\d{2}-\\d{2}T\\d{2}:\\d{2}:\\d{2}\\.\\d{3}Z$",
          "format": "date-time"
        },
        "verifiedAt": {
          "anyOf": [
            {
              "type": "string",
              "pattern": "^\\d{4}-\\d{2}-\\d{2}T\\d{2}:\\d{2}:\\d{2}\\.\\d{3}Z$",
              "format": "date-time"
            },
            {
              "type": "null"
            }
          ]
        },
        "nextDueAt": {
          "anyOf": [
            {
              "type": "string",
              "pattern": "^\\d{4}-\\d{2}-\\d{2}T\\d{2}:\\d{2}:\\d{2}\\.\\d{3}Z$",
              "format": "date-time"
            },
            {
              "type": "null"
            }
          ]
        },
        "staleAfterSeconds": {
          "type": "integer",
          "minimum": 1
        }
      }
    },
    "owner": {
      "type": "object",
      "additionalProperties": false,
      "required": [
        "type",
        "id",
        "label"
      ],
      "properties": {
        "type": {
          "enum": [
            "role",
            "person",
            "agent",
            "automation"
          ]
        },
        "id": {
          "type": "string",
          "pattern": "^[a-z0-9]+(?:-[a-z0-9]+)*$"
        },
        "label": {
          "type": "string",
          "minLength": 1
        }
      }
    },
    "range": {
      "type": "object",
      "additionalProperties": false,
      "required": [
        "min",
        "max"
      ],
      "properties": {
        "min": {
          "type": "number",
          "minimum": 0
        },
        "max": {
          "type": "number",
          "minimum": 0
        }
      }
    },
    "evidenceRequirement": {
      "type": "object",
      "additionalProperties": false,
      "required": [
        "minimumTier",
        "minCount"
      ],
      "properties": {
        "minimumTier": {
          "enum": [
            "assertion",
            "prepared",
            "validated_local",
            "public_reproducible",
            "direct"
          ]
        },
        "minCount": {
          "type": "integer",
          "minimum": 1
        }
      }
    },
    "task": {
      "type": "object",
      "additionalProperties": false,
      "required": [
        "id",
        "name",
        "summary",
        "status",
        "weight",
        "earnedWeight",
        "remainingHours",
        "recurring",
        "deferred",
        "owner",
        "nextAction",
        "evidenceRequirement",
        "evidenceRefs",
        "gateRefs"
      ],
      "properties": {
        "id": {
          "type": "string",
          "pattern": "^[a-z0-9]+(?:-[a-z0-9]+)*$"
        },
        "name": {
          "type": "string",
          "minLength": 1
        },
        "summary": {
          "type": "string",
          "minLength": 1
        },
        "status": {
          "enum": [
            "complete",
            "in_progress",
            "blocked",
            "not_started"
          ]
        },
        "weight": {
          "type": "number",
          "exclusiveMinimum": 0
        },
        "earnedWeight": {
          "type": "number",
          "minimum": 0
        },
        "remainingHours": {
          "anyOf": [
            {
              "$ref": "#/$defs/range"
            },
            {
              "type": "null"
            }
          ]
        },
        "recurring": {
          "type": "boolean"
        },
        "deferred": {
          "type": "boolean"
        },
        "owner": {
          "$ref": "#/$defs/owner"
        },
        "nextAction": {
          "anyOf": [
            {
              "type": "string",
              "minLength": 1
            },
            {
              "type": "null"
            }
          ]
        },
        "evidenceRequirement": {
          "$ref": "#/$defs/evidenceRequirement"
        },
        "evidenceRefs": {
          "type": "array",
          "uniqueItems": true,
          "items": {
            "type": "string",
            "pattern": "^[a-z0-9]+(?:-[a-z0-9]+)*$"
          }
        },
        "gateRefs": {
          "type": "array",
          "uniqueItems": true,
          "items": {
            "type": "string",
            "pattern": "^[a-z0-9]+(?:-[a-z0-9]+)*$"
          }
        }
      }
    },
    "phase": {
      "type": "object",
      "additionalProperties": false,
      "required": [
        "id",
        "name",
        "summary",
        "weight",
        "tasks"
      ],
      "properties": {
        "id": {
          "type": "string",
          "pattern": "^[a-z0-9]+(?:-[a-z0-9]+)*$"
        },
        "name": {
          "type": "string",
          "minLength": 1
        },
        "summary": {
          "type": "string",
          "minLength": 1
        },
        "weight": {
          "type": "number",
          "exclusiveMinimum": 0
        },
        "tasks": {
          "type": "array",
          "minItems": 1,
          "items": {
            "$ref": "#/$defs/task"
          }
        }
      }
    },
    "urlLocator": {
      "type": "object",
      "additionalProperties": false,
      "required": [
        "type",
        "url"
      ],
      "properties": {
        "type": {
          "const": "url"
        },
        "url": {
          "type": "string",
          "pattern": "^https://"
        }
      }
    },
    "fileLocator": {
      "type": "object",
      "additionalProperties": false,
      "required": [
        "type",
        "path"
      ],
      "properties": {
        "type": {
          "const": "file"
        },
        "path": {
          "type": "string",
          "pattern": "^/"
        }
      }
    },
    "conversationLocator": {
      "type": "object",
      "additionalProperties": false,
      "required": [
        "type",
        "reference"
      ],
      "properties": {
        "type": {
          "const": "conversation"
        },
        "reference": {
          "type": "string",
          "minLength": 1
        }
      }
    },
    "commitLocator": {
      "type": "object",
      "additionalProperties": false,
      "required": [
        "type",
        "repository",
        "commit"
      ],
      "properties": {
        "type": {
          "const": "commit"
        },
        "repository": {
          "type": "string",
          "pattern": "^https://"
        },
        "commit": {
          "type": "string",
          "pattern": "^[a-f0-9]{40}$"
        }
      }
    },
    "artifactLocator": {
      "type": "object",
      "additionalProperties": false,
      "required": [
        "type",
        "name",
        "digest"
      ],
      "properties": {
        "type": {
          "const": "artifact"
        },
        "name": {
          "type": "string",
          "minLength": 1
        },
        "digest": {
          "type": "string",
          "pattern": "^[a-f0-9]{64}$"
        }
      }
    },
    "locator": {
      "oneOf": [
        {
          "$ref": "#/$defs/urlLocator"
        },
        {
          "$ref": "#/$defs/fileLocator"
        },
        {
          "$ref": "#/$defs/conversationLocator"
        },
        {
          "$ref": "#/$defs/commitLocator"
        },
        {
          "$ref": "#/$defs/artifactLocator"
        }
      ]
    },
    "integrity": {
      "type": "object",
      "additionalProperties": false,
      "required": [
        "algorithm",
        "digest"
      ],
      "properties": {
        "algorithm": {
          "const": "sha256"
        },
        "digest": {
          "type": "string",
          "pattern": "^[a-f0-9]{64}$"
        }
      }
    },
    "verifier": {
      "type": "object",
      "additionalProperties": false,
      "required": [
        "type",
        "id",
        "label"
      ],
      "properties": {
        "type": {
          "enum": [
            "agent",
            "person",
            "automation"
          ]
        },
        "id": {
          "type": "string",
          "pattern": "^[a-z0-9]+(?:-[a-z0-9]+)*$"
        },
        "label": {
          "type": "string",
          "minLength": 1
        }
      }
    },
    "evidence": {
      "type": "object",
      "additionalProperties": false,
      "required": [
        "id",
        "kind",
        "tier",
        "state",
        "visibility",
        "assertion",
        "publicSummary",
        "capturedAt",
        "verifiedAt",
        "expiresAt",
        "locator",
        "integrity",
        "verifier"
      ],
      "properties": {
        "id": {
          "type": "string",
          "pattern": "^[a-z0-9]+(?:-[a-z0-9]+)*$"
        },
        "kind": {
          "enum": [
            "audit_finding",
            "artifact",
            "deliverable",
            "test_result",
            "external_assertion"
          ]
        },
        "tier": {
          "enum": [
            "assertion",
            "prepared",
            "validated_local",
            "public_reproducible",
            "direct"
          ]
        },
        "state": {
          "enum": [
            "current",
            "stale",
            "revoked",
            "unverified"
          ]
        },
        "visibility": {
          "enum": [
            "public",
            "internal",
            "restricted"
          ]
        },
        "assertion": {
          "type": "string",
          "minLength": 1
        },
        "publicSummary": {
          "type": "string",
          "minLength": 1
        },
        "capturedAt": {
          "type": "string",
          "pattern": "^\\d{4}-\\d{2}-\\d{2}T\\d{2}:\\d{2}:\\d{2}\\.\\d{3}Z$",
          "format": "date-time"
        },
        "verifiedAt": {
          "type": "string",
          "pattern": "^\\d{4}-\\d{2}-\\d{2}T\\d{2}:\\d{2}:\\d{2}\\.\\d{3}Z$",
          "format": "date-time"
        },
        "expiresAt": {
          "anyOf": [
            {
              "type": "string",
              "pattern": "^\\d{4}-\\d{2}-\\d{2}T\\d{2}:\\d{2}:\\d{2}\\.\\d{3}Z$",
              "format": "date-time"
            },
            {
              "type": "null"
            }
          ]
        },
        "locator": {
          "$ref": "#/$defs/locator"
        },
        "integrity": {
          "anyOf": [
            {
              "$ref": "#/$defs/integrity"
            },
            {
              "type": "null"
            }
          ]
        },
        "verifier": {
          "$ref": "#/$defs/verifier"
        }
      }
    },
    "unknownWait": {
      "type": "object",
      "additionalProperties": false,
      "required": [
        "kind",
        "label"
      ],
      "properties": {
        "kind": {
          "const": "unknown"
        },
        "label": {
          "type": "string",
          "minLength": 1
        }
      }
    },
    "rangedWait": {
      "type": "object",
      "additionalProperties": false,
      "required": [
        "kind",
        "label",
        "min",
        "max"
      ],
      "properties": {
        "kind": {
          "enum": [
            "business_days",
            "duration_hours"
          ]
        },
        "label": {
          "type": "string",
          "minLength": 1
        },
        "min": {
          "type": "number",
          "minimum": 0
        },
        "max": {
          "type": "number",
          "minimum": 0
        }
      }
    },
    "wait": {
      "oneOf": [
        {
          "$ref": "#/$defs/unknownWait"
        },
        {
          "$ref": "#/$defs/rangedWait"
        },
        {
          "type": "null"
        }
      ]
    },
    "gate": {
      "type": "object",
      "additionalProperties": false,
      "required": [
        "id",
        "name",
        "type",
        "status",
        "reason",
        "owner",
        "nextAction",
        "wait",
        "taskRefs"
      ],
      "properties": {
        "id": {
          "type": "string",
          "pattern": "^[a-z0-9]+(?:-[a-z0-9]+)*$"
        },
        "name": {
          "type": "string",
          "minLength": 1
        },
        "type": {
          "enum": [
            "provenance",
            "infrastructure",
            "deployment",
            "owner_action",
            "external_approval",
            "policy_decision",
            "security",
            "evidence"
          ]
        },
        "status": {
          "enum": [
            "satisfied",
            "unsatisfied",
            "waiting",
            "waived"
          ]
        },
        "reason": {
          "type": "string",
          "minLength": 1
        },
        "owner": {
          "$ref": "#/$defs/owner"
        },
        "nextAction": {
          "anyOf": [
            {
              "type": "string",
              "minLength": 1
            },
            {
              "type": "null"
            }
          ]
        },
        "wait": {
          "$ref": "#/$defs/wait"
        },
        "taskRefs": {
          "type": "array",
          "uniqueItems": true,
          "items": {
            "type": "string",
            "pattern": "^[a-z0-9]+(?:-[a-z0-9]+)*$"
          }
        }
      }
    },
    "dependency": {
      "type": "object",
      "additionalProperties": false,
      "required": [
        "id",
        "type",
        "prerequisiteTaskId",
        "dependentTaskId"
      ],
      "properties": {
        "id": {
          "type": "string",
          "pattern": "^[a-z0-9]+(?:-[a-z0-9]+)*$"
        },
        "type": {
          "enum": [
            "blocks",
            "informs"
          ]
        },
        "prerequisiteTaskId": {
          "type": "string",
          "pattern": "^[a-z0-9]+(?:-[a-z0-9]+)*$"
        },
        "dependentTaskId": {
          "type": "string",
          "pattern": "^[a-z0-9]+(?:-[a-z0-9]+)*$"
        }
      }
    }
  }
}
